"Status","Start Time","Stop Time","Duration in ms","Parent Suite","Suite","Sub Suite","Test Class","Test Method","Name","Description"
"passed","Tue Apr 01 01:30:13 UTC 2025","Tue Apr 01 01:30:14 UTC 2025","609","Surefire suite","Surefire test","tests.HomePageTest","tests.HomePageTest","testClickLoginMenu","testClickLoginMenu","Check that the Sign Up button appears after clicking Signup/Login in the menu"
"passed","Tue Apr 01 01:30:04 UTC 2025","Tue Apr 01 01:30:08 UTC 2025","3536","Surefire suite","Surefire test","tests.RegistrationTest","tests.RegistrationTest","testRegisterWithValidData","testRegisterWithValidData","Verify that user can register with valid data"
"passed","Tue Apr 01 01:30:09 UTC 2025","Tue Apr 01 01:30:10 UTC 2025","690","Surefire suite","Surefire test","tests.HomePageTest","tests.HomePageTest","testClickCartInMenu","testClickCartInMenu","Check that the Cart page opens after clicking Cart in the menu"
"passed","Tue Apr 01 01:30:11 UTC 2025","Tue Apr 01 01:30:12 UTC 2025","717","Surefire suite","Surefire test","tests.HomePageTest","tests.HomePageTest","testClickContactUsMenu","testClickContactUsMenu","Check that the Contuct Us page opens after ckicking Contact us in the menu"
"passed","Tue Apr 01 01:30:01 UTC 2025","Tue Apr 01 01:30:03 UTC 2025","1533","Surefire suite","Surefire test","tests.RegistrationTest","tests.RegistrationTest","testRedirectToCreateAccountPage","testRedirectToCreateAccountPage","Verify that user is redirected to the Create Account Page"
"passed","Tue Apr 01 01:30:17 UTC 2025","Tue Apr 01 01:30:24 UTC 2025","7035","Surefire suite","Surefire test","tests.HomePageTest","tests.HomePageTest","testClickVideoTutorialsMenu","testClickVideoTutorialsMenu","Check that the YouTube page opens after clicking Video Tutorials in the menu"
"passed","Tue Apr 01 01:30:15 UTC 2025","Tue Apr 01 01:30:16 UTC 2025","643","Surefire suite","Surefire test","tests.HomePageTest","tests.HomePageTest","testClickProductsInMenu","testClickProductsInMenu","Check that the PLP opens after clicking Products in the menu"
